{"archived":{"architecture.yml":{"anti_patterns":[],"dependency_rules":[],"extension_points":[],"layers":[],"modules":[],"patterns":[],"style":"","style_notes":""},"conventions.yml":{"branches":{"default":"","flow":"","model":"","protected":[],"style":""},"code_style":{"enforce_on_save":false,"formatter":"","indent":"","linter":"","max_line_length":0},"commits":{"emoji_map":{},"forbid_in_subject":["ticket numbers without prefix"],"language":"","preset":"","require_body_for":["feat","fix","refactor"],"style":"","subject_max_length":72},"documentation":{"api_docs":"","changelog":"","readme_required":true},"naming":{"classes":"","constants":"","directories":"","files":"","test_files":"","variables":""},"review_checklist":[],"tests":{"coverage_min":0,"location":"","required":true,"run_before_commit":true,"types":{"e2e":false,"integration":false,"unit":true}}},"orchestration.yml":{"allow_external_cwd":false,"default_harness":"pi","default_profile":null,"enabled":false,"harnesses":{"aider":{"args":["--model","{model}","--chat-mode","ask","--message-file","{prompt_file}"],"command":"aider","default_effort":"default","default_model":"sonnet","enabled":true,"models_args":["--list-models"],"models_command":"aider","prompt_delivery":"file","supports_effort":false,"supports_model":true},"aider-write":{"args":["--model","{model}","--chat-mode","code","--yes-always","--message-file","{prompt_file}"],"command":"aider","default_effort":"default","default_model":"sonnet","enabled":true,"models_args":["--list-models"],"models_command":"aider","prompt_delivery":"file","supports_effort":false,"supports_model":true},"claude":{"args":["-p","--model","{model}","--effort","{effort}","--permission-mode","plan","--output-format","text"],"command":"claude","default_effort":"high","default_model":"sonnet","enabled":true,"models_args":["--help"],"models_command":"claude","prompt_delivery":"stdin","supports_effort":true,"supports_model":true},"claude-write":{"args":["-p","--model","{model}","--effort","{effort}","--permission-mode","acceptEdits","--output-format","text"],"command":"claude","default_effort":"high","default_model":"sonnet","enabled":true,"models_args":["--help"],"models_command":"claude","prompt_delivery":"stdin","supports_effort":true,"supports_model":true},"codex":{"args":["exec","--model","{model}","--config","model_reasoning_effort={effort}","--sandbox","read-only","--ask-for-approval","never",[null]],"command":"codex","default_effort":"high","default_model":"gpt-5.4","enabled":true,"models_args":["--help"],"models_command":"codex","prompt_delivery":"stdin","supports_effort":true,"supports_model":true},"codex-write":{"args":["exec","--model","{model}","--config","model_reasoning_effort={effort}","--sandbox","workspace-write","--ask-for-approval","on-failure",[null]],"command":"codex","default_effort":"high","default_model":"gpt-5.4","enabled":true,"models_args":["--help"],"models_command":"codex","prompt_delivery":"stdin","supports_effort":true,"supports_model":true},"gemini":{"args":["--model","{model}","--prompt"],"command":"gemini","default_effort":"default","default_model":"gemini-2.5-pro","enabled":true,"models_args":["--help"],"models_command":"gemini","prompt_delivery":"argument","supports_effort":false,"supports_model":true},"gemini-write":{"args":["--model","{model}","--approval-mode","auto_edit","--prompt"],"command":"gemini","default_effort":"default","default_model":"gemini-2.5-pro","enabled":true,"models_args":["--help"],"models_command":"gemini","prompt_delivery":"argument","supports_effort":false,"supports_model":true},"opencode":{"args":["run","--model","{model}","--variant","{effort}","--agent","plan"],"command":"opencode","default_effort":"high","default_model":"anthropic/claude-sonnet-4-5","enabled":true,"models_args":["models"],"models_command":"opencode","prompt_delivery":"argument","supports_effort":true,"supports_model":true},"opencode-write":{"args":["run","--model","{model}","--variant","{effort}","--agent","build"],"command":"opencode","default_effort":"high","default_model":"anthropic/claude-sonnet-4-5","enabled":true,"models_args":["models"],"models_command":"opencode","prompt_delivery":"argument","supports_effort":true,"supports_model":true},"pi":{"args":["-p","--no-session","--model","{model}","--thinking","{effort}"],"command":"pi","default_effort":"high","default_model":"anthropic/claude-sonnet-4-5","enabled":true,"models_args":["--list-models"],"models_command":"pi","prompt_delivery":"argument","supports_effort":true,"supports_model":true}},"jobs_dir":".workflow/runs","profiles":null,"schema_version":2},"presets.yml":{"features":[{"controls":["workflow.yml → process.require_analysis"],"defaults":{"fast":true,"full":true,"medium":true},"description":"Mandatory Analyze stage (AGENTS.md §3.1) before any work.","id":"require_analysis","question":"Require an explicit Analyze stage before coding?"},{"controls":["workflow.yml → process.plan.required"],"defaults":{"fast":true,"full":true,"medium":true},"description":"Mandatory self-contained plan file written to .workflow/history/.","id":"require_plan","question":"Require a written, self-contained plan file per task?"},{"controls":["workflow.yml → process.require_options.enabled"],"defaults":{"fast":false,"full":true,"medium":true},"description":"Require 2+ solution options with pros/cons before planning.","id":"require_options","question":"Require comparing multiple solution options before planning?"},{"controls":["workflow.yml → process.light_tdd.enabled","workflow.yml → process.light_tdd.mode"],"defaults":{"fast":false,"full":true,"medium":false},"description":"Light TDD (strict-lite) for non-trivial behavior changes.","id":"light_tdd","question":"Enable light TDD (test-first for behavior changes)?","when_enabled_mode":"strict-lite"},{"controls":["workflow.yml → process.granular_commits.enabled","workflow.yml → process.granular_commits.mode"],"defaults":{"fast":false,"full":true,"medium":true},"description":"Split large tasks into verified-checkpoint commits.","id":"granular_commits","question":"Enable granular checkpoint commits for large tasks?","when_enabled_mode":"auto"},{"controls":["workflow.yml → scope_control.no_unrelated_refactors","workflow.yml → scope_control.no_unrequested_dependencies","workflow.yml → scope_control.ask_before_destructive"],"defaults":{"fast":true,"full":true,"medium":true},"description":"Guardrails: no unrelated refactors, ask before destructive actions.","id":"scope_control","question":"Keep scope-control guardrails on (recommended)?"},{"controls":["workflow.yml → git.three_branch_model.enabled","conventions.yml → branches.model","conventions.yml → branches.protected"],"defaults":{"fast":false,"full":true,"medium":true},"description":"Maintain main / stage / dev branches in the repo.","id":"three_branch_model","question":"Maintain a main / stage / dev branch layout in this repo?"}],"meta":{"active_preset":null},"presets":{"fast":{"description":"Brief analyze + written plan. No options comparison, no TDD, no granular checkpoint commits. Best for prototypes, spikes, and solo exploratory work.\n","features":{"granular_commits":false,"light_tdd":false,"require_analysis":true,"require_options":false,"require_plan":true,"scope_control":true,"three_branch_model":false},"label":"Fast — minimal process, plan only"},"full":{"description":"All stages mandatory, including light TDD (strict-lite) for non-trivial behavior changes. Best for production codebases and teams that want the strongest guardrails.\n","features":{"granular_commits":true,"light_tdd":true,"require_analysis":true,"require_options":true,"require_plan":true,"scope_control":true,"three_branch_model":true},"label":"Full — complete workflow"},"medium":{"description":"Analyze + options comparison + plan + granular checkpoint commits. No mandatory TDD. Good default for most feature work.\n","features":{"granular_commits":true,"light_tdd":false,"require_analysis":true,"require_options":true,"require_plan":true,"scope_control":true,"three_branch_model":true},"label":"Medium — balanced"}}},"session.local.yml":{"schema_version":1,"subagents":{"mode":"ask"}},"stack.yml":{"build_and_run":{"build":"","dev":"","format":"","install":"","lint":"","test":""},"datastores":{"cache":"","other":[],"primary":"","search":""},"external_services":[],"frameworks":{"backend":[],"frontend":[],"testing":[]},"infra":{"ci":"","containerization":"","hosting":"","orchestration":""},"languages":[],"meta":{"description":"","project_kind":"","project_name":""},"runtimes":[]},"status.yml":{"active_preset":null,"checks":{"required_fields_filled":false,"required_files_present":false},"features":{"granular_commits":true,"light_tdd":true,"require_analysis":true,"require_options":true,"require_plan":true,"scope_control":true,"three_branch_model":false},"initialized":false,"lazy_load":{"architecture":".workflow/architecture.yml","bootstrap":".workflow/bootstrap.md","conventions":".workflow/conventions.yml","delegation":".workflow/delegation.md","history_format":".workflow/history-format.md","orchestration":".workflow/orchestration.yml","presets":".workflow/presets.yml","stack":".workflow/stack.yml","subagents":".workflow/subagents.md","workflow_rules":".workflow/workflow.yml"},"native_subagents":{"missing_or_invalid_mode":"ask","policy":".workflow/session.local.yml"},"notes":["If initialized is not true, active_preset is null, or any check is false, read .workflow/bootstrap.md.","Do not read stack/architecture/conventions/workflow/presets at startup unless the fast check fails."],"orchestration":{"config":".workflow/orchestration.yml","default_harness":"pi","default_profile":null,"enabled":false,"runner":".workflow/bin/hekate-agent"},"required_files":[".workflow/stack.yml",".workflow/architecture.yml",".workflow/conventions.yml",".workflow/workflow.yml",".workflow/presets.yml"],"required_non_empty_fields":{"architecture.yml":["style","layers"],"conventions.yml":["code_style.formatter","naming.files